{
  "schema_version": "AGL_LITE_V1_2_1",
  "project_id": "AGL-LITE-EXAMPLE",
  "policy_version": "policy-v1.2.1",
  "created_at_utc": "2026-10-27T00:00:00Z",
  "review_id": "RV-001",
  "task_id": "TASK-001",
  "attempt_id": "ATT-001",
  "reviewer_id": "AGENT_B",
  "author_id": "AGENT_A",
  "status": "PENDING",
  "spec_hash": "aaaaaaaaaaaaaaaaaaaaaaaaaaaaaaaaaaaaaaaaaaaaaaaaaaaaaaaaaaaaaaaa",
  "base_sha": "bbbbbbbbbbbbbbbbbbbbbbbbbbbbbbbbbbbbbbbb",
  "candidate_tree_sha": "cccccccccccccccccccccccccccccccccccccccc",
  "reviewed_tree_sha": "cccccccccccccccccccccccccccccccccccccccc",
  "evidence_digest": "aaaaaaaaaaaaaaaaaaaaaaaaaaaaaaaaaaaaaaaaaaaaaaaaaaaaaaaaaaaaaaaa",
  "test_run_id": "TR-001",
  "review_evidence_ref": "reviews/RV-001.json",
  "independence_group": "GROUP-001"
}
